[
  {
    "id": 1,
    "number": 100,
    "name": "[URGENT] Delivery: Tranquilizers",
    "max_likes": 45,
    "weight": 24,
    "client_id": 1,
    "destination_id": 34,
    "delivery_category_id": 1
  },
  {
    "id": 2,
    "number": 101,
    "name": "Materials Delivery: Metals & Ceramics",
    "max_likes": 311,
    "weight": 1300,
    "client_id": 1,
    "destination_id": 34,
    "delivery_category_id": 2
  },
  {
    "id": 3,
    "number": 102,
    "name": "[Re-order] Delivery: Smart Drugs to Waystation West of Capital Knot City",
    "max_likes": 20,
    "weight": 15,
    "client_id": 1,
    "destination_id": 34,
    "delivery_category_id": 3
  },
  {
    "id": 4,
    "number": 103,
    "name": "Delivery: Prototype Chiral Network Stabilizers",
    "max_likes": 43,
    "weight": 340,
    "client_id": 1,
    "destination_id": 8,
    "delivery_category_id": 3
  },
  {
    "id": 5,
    "number": 104,
    "name": "[URGENT] Materials Delivery: Metals",
    "max_likes": 135,
    "weight": 600,
    "client_id": 1,
    "destination_id": 8,
    "delivery_category_id": 1
  },
  {
    "id": 6,
    "number": 105,
    "name": "Delivery: Emergency Cogeneration Unit Fuel",
    "max_likes": 214,
    "weight": 900,
    "client_id": 1,
    "destination_id": 36,
    "delivery_category_id": 2
  },
  {
    "id": 7,
    "number": 106,
    "name": "Materials Delivery: Resins",
    "max_likes": 146,
    "weight": 160,
    "client_id": 1,
    "destination_id": 36,
    "delivery_category_id": 2
  },
  {
    "id": 8,
    "number": 107,
    "name": "Delivery (Fragile): Prototype Ship Motors",
    "max_likes": 69,
    "weight": 400,
    "client_id": 1,
    "destination_id": 27,
    "delivery_category_id": 3
  },
  {
    "id": 9,
    "number": 108,
    "name": "[Re-order] Emergency Provisions Delivery: Port Knot City",
    "max_likes": 176,
    "weight": 500,
    "client_id": 1,
    "destination_id": 27,
    "delivery_category_id": 2
  },
  {
    "id": 10,
    "number": 109,
    "name": "Delivery: Figurines by the Legendary Artist \"SK\"",
    "max_likes": 41,
    "weight": 260,
    "client_id": 1,
    "destination_id": 19,
    "delivery_category_id": 3
  },
  {
    "id": 11,
    "number": 110,
    "name": "Delivery: Old Components for Musical Instrument Repair",
    "max_likes": 32,
    "weight": 170,
    "client_id": 1,
    "destination_id": 23,
    "delivery_category_id": 3
  },
  {
    "id": 12,
    "number": 111,
    "name": "[URGENT] Delivery: Outdoor Concert Footage",
    "max_likes": 41,
    "weight": 120,
    "client_id": 1,
    "destination_id": 23,
    "delivery_category_id": 1
  },
  {
    "id": 13,
    "number": 112,
    "name": "Delivery (Time-sensitive): Fish from a BT Area",
    "max_likes": 26,
    "weight": 140,
    "client_id": 34,
    "destination_id": 1,
    "delivery_category_id": 1
  },
  {
    "id": 14,
    "number": 113,
    "name": "Materials Delivery: Resins & Metals",
    "max_likes": 138,
    "weight": 1040,
    "client_id": 34,
    "destination_id": 1,
    "delivery_category_id": 2
  },
  {
    "id": 15,
    "number": 114,
    "name": "Retrieval: Structure Repair Devices Lost During Delivery",
    "max_likes": 141,
    "weight": 860,
    "client_id": 34,
    "destination_id": 34,
    "delivery_category_id": 4
  },
  {
    "id": 16,
    "number": 115,
    "name": "Delivery (Fragile): Chiral Crystal Analyzers",
    "max_likes": 71,
    "weight": 720,
    "client_id": 34,
    "destination_id": 8,
    "delivery_category_id": 2
  },
  {
    "id": 17,
    "number": 116,
    "name": "Materials Delivery: Resins",
    "max_likes": 46,
    "weight": 240,
    "client_id": 34,
    "destination_id": 8,
    "delivery_category_id": 3
  },
  {
    "id": 18,
    "number": 117,
    "name": "[URGENT] Materials Delivery: Ceramics",
    "max_likes": 102,
    "weight": 640,
    "client_id": 34,
    "destination_id": 8,
    "delivery_category_id": 1
  },
  {
    "id": 19,
    "number": 118,
    "name": "[Re-order] Rare Materials Delivery: Distribution Center West of Capital Knot City",
    "max_likes": 101,
    "weight": 300,
    "client_id": 34,
    "destination_id": 8,
    "delivery_category_id": 2
  },
  {
    "id": 20,
    "number": 119,
    "name": "Delivery (Fragile): Emergency Natural Gas Supplies",
    "max_likes": 103,
    "weight": 500,
    "client_id": 34,
    "destination_id": 36,
    "delivery_category_id": 3
  },
  {
    "id": 21,
    "number": 120,
    "name": "Materials Delivery: Metals",
    "max_likes": 123,
    "weight": 600,
    "client_id": 34,
    "destination_id": 36,
    "delivery_category_id": 2
  },
  {
    "id": 22,
    "number": 121,
    "name": "Delivery (Fragile): Chiral Contamination Gauges",
    "max_likes": 35,
    "weight": 150,
    "client_id": 34,
    "destination_id": 27,
    "delivery_category_id": 3
  },
  {
    "id": 23,
    "number": 122,
    "name": "Delivery: Extremely Rare Monster Figurines",
    "max_likes": 23,
    "weight": 260,
    "client_id": 34,
    "destination_id": 19,
    "delivery_category_id": 3
  },
  {
    "id": 24,
    "number": 123,
    "name": "Delivery: Stress-relief Toys",
    "max_likes": 22,
    "weight": 300,
    "client_id": 34,
    "destination_id": 19,
    "delivery_category_id": 3
  },
  {
    "id": 25,
    "number": 124,
    "name": "Delivery: Series of Classic Novelsâ€”\"Porters in the Storm\"",
    "max_likes": 33,
    "weight": 160,
    "client_id": 34,
    "destination_id": 19,
    "delivery_category_id": 3
  },
  {
    "id": 26,
    "number": 125,
    "name": "Delivery: Forest Soil Samples",
    "max_likes": 78,
    "weight": 600,
    "client_id": 8,
    "destination_id": 1,
    "delivery_category_id": 2
  },
  {
    "id": 27,
    "number": 126,
    "name": "[Re-order] [URGENT] Cryptobiote Delivery: Capital Knot City",
    "max_likes": 48,
    "weight": 300,
    "client_id": 8,
    "destination_id": 1,
    "delivery_category_id": 1
  },
  {
    "id": 28,
    "number": 127,
    "name": "Delivery: Pre-Stranding Movie Footage",
    "max_likes": 54,
    "weight": 56,
    "client_id": 8,
    "destination_id": 34,
    "delivery_category_id": 3
  },
  {
    "id": 29,
    "number": 128,
    "name": "[Re-order] Recovery: Confidential Documents",
    "max_likes": 36,
    "weight": 10,
    "client_id": 8,
    "destination_id": 34,
    "delivery_category_id": 4
  },
  {
    "id": 30,
    "number": 129,
    "name": "[Re-order] Recovery: Chiral Printer Interface",
    "max_likes": 43,
    "weight": 300,
    "client_id": 8,
    "destination_id": 8,
    "delivery_category_id": 4
  },
  {
    "id": 31,
    "number": 130,
    "name": "[URGENT] Delivery: Emergency Fuel",
    "max_likes": 102,
    "weight": 1200,
    "client_id": 8,
    "destination_id": 36,
    "delivery_category_id": 1
  },
  {
    "id": 32,
    "number": 131,
    "name": "Delivery: Materials for Urban Expansion",
    "max_likes": 236,
    "weight": 2200,
    "client_id": 8,
    "destination_id": 27,
    "delivery_category_id": 2
  },
  {
    "id": 33,
    "number": 132,
    "name": "Delivery (Fragile): Vintage Sound Systems",
    "max_likes": 24,
    "weight": 90,
    "client_id": 8,
    "destination_id": 23,
    "delivery_category_id": 3
  },
  {
    "id": 34,
    "number": 133,
    "name": "Delivery: Power Supply Inspection Tools",
    "max_likes": 20,
    "weight": 150,
    "client_id": 36,
    "destination_id": 8,
    "delivery_category_id": 3
  },
  {
    "id": 35,
    "number": 134,
    "name": "Delivery: High-quality Timefall-resistant Wood",
    "max_likes": 101,
    "weight": 1360,
    "client_id": 36,
    "destination_id": 8,
    "delivery_category_id": 2
  },
  {
    "id": 36,
    "number": 135,
    "name": "[URGENT] Delivery: Repaired Transformer Units",
    "max_likes": 94,
    "weight": 1320,
    "client_id": 36,
    "destination_id": 8,
    "delivery_category_id": 1
  },
  {
    "id": 37,
    "number": 136,
    "name": "Delivery: Adrenaline-boosting beverages",
    "max_likes": 20,
    "weight": 150,
    "client_id": 36,
    "destination_id": 8,
    "delivery_category_id": 3
  },
  {
    "id": 38,
    "number": 137,
    "name": "Materials Delivery: Resins",
    "max_likes": 76,
    "weight": 640,
    "client_id": 36,
    "destination_id": 8,
    "delivery_category_id": 3
  },
  {
    "id": 39,
    "number": 138,
    "name": "Delivery: Naturally Timefall-resistant Wood",
    "max_likes": 34,
    "weight": 30,
    "client_id": 36,
    "destination_id": 1,
    "delivery_category_id": 3
  },
  {
    "id": 40,
    "number": 139,
    "name": "Materials Delivery: Metals",
    "max_likes": 64,
    "weight": 200,
    "client_id": 36,
    "destination_id": 1,
    "delivery_category_id": 3
  },
  {
    "id": 41,
    "number": 140,
    "name": "Delivery: Books that Foretell the Existence of the Beach",
    "max_likes": 101,
    "weight": 760,
    "client_id": 36,
    "destination_id": 34,
    "delivery_category_id": 2
  },
  {
    "id": 42,
    "number": 141,
    "name": "Materials Delivery: Metals",
    "max_likes": 687,
    "weight": 1500,
    "client_id": 36,
    "destination_id": 34,
    "delivery_category_id": 2
  },
  {
    "id": 43,
    "number": 142,
    "name": "Materials Delivery: Metals",
    "max_likes": 26,
    "weight": 100,
    "client_id": 36,
    "destination_id": 34,
    "delivery_category_id": 3
  },
  {
    "id": 44,
    "number": 143,
    "name": "Recovery: Cogeneration Units Lost During Delivery",
    "max_likes": 66,
    "weight": 1200,
    "client_id": 36,
    "destination_id": 36,
    "delivery_category_id": 4
  },
  {
    "id": 45,
    "number": 144,
    "name": "[URGENT] Delivery: Ludens Art Books",
    "max_likes": 30,
    "weight": 40,
    "client_id": 36,
    "destination_id": 19,
    "delivery_category_id": 1
  },
  {
    "id": 46,
    "number": 145,
    "name": "Delivery (Fragile & Time-sensitive): Large Consignment of Beer for a Party",
    "max_likes": 2379,
    "weight": 8400,
    "client_id": 27,
    "destination_id": 1,
    "delivery_category_id": 1
  },
  {